{
  "$schema": "https://json-schema.org/draft/2020-12/schema",
  "$id": "https://github.com/deradon/wow-forever-talent-calc/data/schema/race.schema.json",
  "title": "WoW Forever race file",
  "description": "One playable race: faction, variants, playable classes, racial traits and lore. Normative prose: docs/DATA-SCHEMA-RACES.md.",
  "type": "object",
  "additionalProperties": false,
  "required": [
    "schemaVersion",
    "race",
    "raceName",
    "faction",
    "dataSource",
    "generatedAt",
    "classes",
    "traits",
    "complete"
  ],
  "properties": {
    "$schema": {
      "type": "string"
    },
    "schemaVersion": {
      "type": "integer",
      "const": 1
    },
    "race": {
      "$ref": "#/$defs/slug",
      "description": "Equals the file name stem."
    },
    "raceName": {
      "type": "string",
      "minLength": 1,
      "maxLength": 40
    },
    "faction": {
      "enum": ["alliance", "horde", "neutral"]
    },
    "dataSource": {
      "enum": ["video", "datamined", "mixed", "manual"]
    },
    "generatedAt": {
      "type": "string",
      "pattern": "^\\d{4}-\\d{2}-\\d{2}T\\d{2}:\\d{2}:\\d{2}(\\.\\d+)?(Z|[+-]\\d{2}:\\d{2})$"
    },
    "variants": {
      "type": "array",
      "minItems": 2,
      "description": "Only for a race the picker shows in both faction columns (Skyborne). Omitted otherwise.",
      "items": {
        "type": "object",
        "additionalProperties": false,
        "required": ["id", "name", "faction", "classes"],
        "properties": {
          "id": {
            "$ref": "#/$defs/slug"
          },
          "name": {
            "type": "string",
            "minLength": 1,
            "maxLength": 60
          },
          "faction": {
            "enum": ["alliance", "horde"]
          },
          "classes": {
            "$ref": "#/$defs/classList"
          },
          "lore": {
            "type": "string",
            "maxLength": 1200
          },
          "loreComplete": {
            "type": "boolean"
          }
        }
      }
    },
    "classes": {
      "$ref": "#/$defs/classList",
      "description": "Union over the variants. Empty = the class bar was never on screen for this race."
    },
    "classesSource": {
      "$ref": "#/$defs/source"
    },
    "lore": {
      "type": "string",
      "maxLength": 1200
    },
    "loreComplete": {
      "type": "boolean",
      "description": "false when the paragraph continued past the box edge."
    },
    "loreSource": {
      "$ref": "#/$defs/source"
    },
    "traits": {
      "type": "array",
      "minItems": 0,
      "items": {
        "$ref": "#/$defs/trait"
      }
    },
    "complete": {
      "type": "boolean",
      "description": "true only when the first and the last trait row were both anchored (race name seen above, lore seen below)."
    },
    "notes": {
      "type": "array",
      "items": {
        "type": "string"
      }
    }
  },
  "$defs": {
    "slug": {
      "type": "string",
      "pattern": "^[a-z0-9]+(-[a-z0-9]+)*$",
      "maxLength": 64
    },
    "classList": {
      "type": "array",
      "uniqueItems": true,
      "items": {
        "enum": ["druid", "hunter", "mage", "paladin", "priest", "rogue", "shaman", "warlock", "warrior"]
      }
    },
    "trait": {
      "type": "object",
      "additionalProperties": false,
      "required": ["id", "name", "kind", "order", "classic", "source"],
      "properties": {
        "id": {
          "$ref": "#/$defs/slug"
        },
        "name": {
          "type": "string",
          "minLength": 1,
          "maxLength": 60
        },
        "kind": {
          "enum": ["active", "passive"]
        },
        "order": {
          "type": "integer",
          "minimum": 0,
          "description": "0-based position of the row in the race box, top to bottom, stitched from the overlapping scroll positions."
        },
        "variants": {
          "type": "array",
          "minItems": 1,
          "uniqueItems": true,
          "items": {
            "$ref": "#/$defs/slug"
          },
          "description": "Variant ids this trait was seen in. Present iff the file has variants."
        },
        "description": {
          "type": "string",
          "minLength": 1,
          "maxLength": 400,
          "description": "Absent when the trait is known only by name (spellbook fallback)."
        },
        "icon": {
          "type": "string",
          "minLength": 1,
          "maxLength": 80
        },
        "iconSource": {
          "enum": ["classic", "crop", "datamined", "manual"]
        },
        "iconCrop": {
          "type": "string",
          "pattern": "^data/review/races/"
        },
        "classic": {
          "type": "object",
          "additionalProperties": false,
          "required": ["status"],
          "properties": {
            "status": {
              "enum": ["new", "changed", "same", "unknown"]
            },
            "classicName": {
              "type": "string"
            },
            "classicText": {
              "type": "string"
            },
            "note": {
              "type": "string"
            }
          }
        },
        "tags": {
          "type": "array",
          "items": {
            "type": "string"
          },
          "uniqueItems": true
        },
        "source": {
          "$ref": "#/$defs/source"
        }
      }
    },
    "source": {
      "type": "object",
      "additionalProperties": false,
      "required": ["kind", "reviewed"],
      "properties": {
        "kind": {
          "enum": ["video", "datamined", "manual"]
        },
        "video": {
          "type": "string"
        },
        "t": {
          "type": "number",
          "minimum": 0
        },
        "frame": {
          "type": "integer",
          "minimum": 0
        },
        "crop": {
          "type": "string"
        },
        "panel": {
          "enum": ["race-panel", "class-bar", "spellbook-general"],
          "description": "Which piece of UI the reading comes from."
        },
        "confidence": {
          "type": "number",
          "minimum": 0,
          "maximum": 1
        },
        "reader": {
          "type": "string"
        },
        "readings": {
          "type": "array",
          "items": {
            "type": "object",
            "additionalProperties": false,
            "required": ["reader"],
            "properties": {
              "reader": {
                "type": "string"
              },
              "name": {
                "type": "string"
              },
              "description": {
                "type": "string"
              },
              "confidence": {
                "type": "number",
                "minimum": 0,
                "maximum": 1
              }
            }
          }
        },
        "build": {
          "type": "string"
        },
        "reviewed": {
          "type": "boolean"
        },
        "reviewedBy": {
          "type": "string"
        },
        "reviewedAt": {
          "type": "string"
        },
        "note": {
          "type": "string"
        }
      }
    }
  }
}
